{"$id":"https://justinahiggins614-cmyk.github.io/signature-books/data/index/books-schema.json","$schema":"http://json-schema.org/draft-07/schema#","definitions":{"chunk":{"description":"Volume chunk: data/volumes/books-cNNNNN.json.gz — gzip JSON array of 100 full book records (last chunk may be partial only mid-drip; sealed chunks are exactly 100).","properties":{"book_count":{"type":"integer"},"canonical_url":{"type":"string"},"chunk_id":{"pattern":"^books-c[0-9]{5}$","type":"string"},"content_sha256":{"description":"SHA-256 of the canonical chunk bytes.","type":"string"},"first_book_id":{"type":"string"},"last_book_id":{"type":"string"},"next_chunk":{"type":["string","null"]},"previous_chunk":{"type":["string","null"]}},"type":"object"},"creation_mode":{"description":"Derived from origin. ORIGINAL = origin 'original' (standalone Signature work). DERIVED = any other origin (seeded by a network record; lineage in sources[]).","enum":["ORIGINAL","DERIVED"]},"index_entry":{"description":"Compact per-book row in data/index/books.idx.json.gz (gzip JSON array). Field map kept short for wire size; full records live in the volume chunks.","properties":{"a":{"description":"author","type":"string"},"ch":{"description":"chapter titles","items":{"type":"string"},"type":"array"},"d":{"description":"description","type":"string"},"g":{"description":"genre (display)","type":"string"},"id":{"description":"JAH-BOOK-######","type":"string"},"o":{"description":"origin slot","type":"string"},"t":{"description":"title","type":"string"},"w":{"description":"word count","type":"integer"}},"required":["id","t","a","g","w","d","o","ch"],"type":"object"},"record_status":{"description":"Internal publication state. The public catalog only ever lists PUBLISHED books.","enum":["DRAFT","GENERATING","VALIDATING","PUBLISHED","REVISED","RETIRED"]}},"description":"Permanent record standard for The Signature Book Depository. Every book carries one immutable JAH-BOOK-###### ID (never reused, never changed by a title change). Records are immutable: books are only written once finished (record status PUBLISHED by construction; the drip's state.json next_index never revisits an ID), so BOOK ID and BOOK VERSION stay 1:1 — a corrected book would be issued a new version, never a silent overwrite. No real-world authors, no borrowed text, no trademarked characters, no fake ISBNs or publishers. No license field is invented: reuse rights are stated per record as read/copy/download permitted.","properties":{"author":{"description":"Signature-system author name (generated persona). Never a real-world author.","type":"string"},"chapters":{"description":"Full book content, chapter by chapter. A finished book always ships complete chapters — 'Every book finished' means every displayed book passed this bar.","items":{"properties":{"b":{"description":"Chapter body text. Poetry preserves line breaks; prose uses blank-line paragraph breaks.","type":"string"},"t":{"description":"Chapter title.","type":"string"}},"required":["t","b"],"type":"object"},"minItems":1,"type":"array"},"desc":{"description":"Short description / blurb.","minLength":1,"type":"string"},"genre":{"description":"Display genre. Mutually exclusive: exactly one per book; genre counts sum to total_books.","type":"string"},"gkey":{"description":"Machine genre key (e.g. scifi, poetry, techmanual).","type":"string"},"id":{"description":"Permanent immutable book ID. Canonical URL: https://justinahiggins614-cmyk.github.io/signature-books/?book=<ID>","pattern":"^JAH-BOOK-[0-9]{6}$","type":"string"},"note":{"description":"Honesty note carried on every book: an original generated work by the Signature system; all names/places/events invented.","type":"string"},"origin":{"description":"Creation slot. Mutually exclusive: exactly one per book. 'original' = standalone Signature-original (CREATION-MODE ORIGINAL). The other six = DERIVED: the book was seeded by that network record type and carries a source-lineage link in sources[].","enum":["original","spec","wiki","leaks","patent","ai","mall"],"type":"string"},"sources":{"description":"Source-lineage records. Empty for standalone originals. Each entry links the exact network record that seeded the book.","items":{"properties":{"blurb":{"description":"Source blurb where available.","type":"string"},"id":{"description":"Source record ID (e.g. JAH-SPEC-022648).","type":"string"},"kind":{"description":"Source record type.","enum":["spec","wiki","leaks","patent","ai","mall"],"type":"string"},"label":{"description":"Human label, e.g. 'Based on JAH-SPEC-022648'.","type":"string"},"title":{"description":"Source record title where available.","type":"string"},"url":{"description":"Deep link to the exact source record.","format":"uri","type":"string"}},"required":["kind","id","label","url"],"type":"object"},"type":"array"},"title":{"description":"Book title. Unique across the catalog (the drip appends ' (Vol. N)' on collision).","minLength":1,"type":"string"},"words":{"description":"Total word count (title + description + all chapters).","minimum":1,"type":"integer"}},"required":["id","title","author","genre","gkey","desc","words","chapters","note","sources","origin"],"title":"JAH-BOOK-RECORD/1.0","type":"object","version":"1.0"}