{
 "id": "JAH-BOOK-000001",
 "title": "Echoes Of The Nebula",
 "author": "Justin Addam Higgins",
 "genre": "Science Fiction",
 "gkey": "sf",
 "desc": "A sweeping tale of courage: Halhal Corwick and Owick Rogwen journey toward the Kepler Belt, where the variant beacon will decide everything. A finished Signature novel: 10 chapters, full text, ready to read aloud. Inspired by Based on JAH-SPEC-022648.",
 "words": 2168,
 "chapters": [
  {
   "t": "Launch Window",
   "b": "The plan was fragile: reach the Kepler Belt before the void-born did. Every map agreed on one thing: the variant beacon belonged in the Kepler Belt. By midday the wind had changed, and Owick Rogwen knew they were being watched. The variant beacon had been lost for years, and everyone in the Helios Array knew the stories.\n\nThe void-born communicated in static, and Owick Rogwen was learning to read it. void-born sent a threat that Dovane Corwick could not ignore. \"I did not choose this,\" Dovane Corwick said. \"Yet here we are.\" The variant beacon pulsed faintly, as if it recognized Dovane Corwick. The skeptics of the Helios Array would ask, and Dovane Corwick would tell it true. Dovane Corwick looked at what remained of the variant beacon and bowed. That evening, Dovane Corwick and Owick Rogwen argued under unfamiliar stars.\n\nBy midday the sky had changed, and Owick Rogwen knew they were being watched. Shipboard time behaved strangely near the variant beacon. Dovane Corwick sealed the hatch and trusted the math. Owick Rogwen stayed in the Kepler Belt, or so the song goes.\n\nDawn came soft over the Kepler Belt, and it was over. Dovane Corwick earned peace. Nights on the road were for watching the sky, and Owick Rogwen had the best stories. Nobody in the Helios Array believed strangers, but Dovane Corwick was no ordinary stranger. Owick Rogwen knew the old songs through the Kepler Belt, the ones the maps had forgotten. The battle lasted all night."
  },
  {
   "t": "The Long Dark",
   "b": "Ricott Corwick learned that the variant beacon was not a tool at all, but a mirror. Nights on the road were for stories, and Owick Rogwen had the best stories. Ricott Corwick packed little and left the Helios Array without saying goodbye. The variant beacon went quiet, and the void-born fled. Ricott Corwick sealed the bulkhead and trusted the math.\n\nSomewhere past the Kepler Belt, physics filed a formal complaint. The variant beacon was hidden again, but its light remained. But the summer after, the roads were kinder, and people noticed.\n\nThat evening, Ricott Corwick and Owick Rogwen made a plan under unfamiliar stars. Shipboard air behaved strangely near the variant beacon. Ricott Corwick looked back, and in that pause the whole plan changed. Ricott Corwick packed a small bag and left the Helios Array without saying goodbye. The variant beacon glowed faintly, as if it recognized Ricott Corwick. Ricott Corwick woke before dawn, the way Ricott Corwick always did when something was about to change.\n\nThe road to the Kepler Belt was forgotten, and the summer made it worse. \"We go now,\" Owick Rogwen said. \"The void-born already knows.\" Years later, in the Helios Array, they still argue about what Ricott Corwick did. The road home to the Helios Array felt shorter than the road out. The Signal drifted in high orbit, dark. The void-born listened, patient as stone. But the summer after, the harvest were kinder, and people noticed.\n\nEvery song agreed on one thing: the variant beacon belonged in the Kepler Belt. The road home to the Helios Array felt shorter than the road out. The colony's dome was failing, and only the variant beacon could restart it. The first trial came sooner than anyone expected. What the variant beacon had hidden could never quite be measured."
  },
  {
   "t": "Signal Lost",
   "b": "The plan was simple: reach the Kepler Belt before the void-born did. Shipboard gravity behaved strangely near the variant beacon. Naren Corwick sealed the airlock and trusted the math. Naren Corwick had never feared this, but the variant beacon had chosen, and choice was a kind of gravity. And somewhere beyond the Kepler Belt, the stars kept the secret. Naren Corwick woke before dawn, the way Naren Corwick always did when something was about to change.\n\nOwick Rogwen arrived with word, breathless and solemn. Naren Corwick found a quiet life. Naren Corwick never boasted that summer. void-born had agents everywhere, or so the whispers claimed. Stars looked beautiful through the cracked viewport.\n\nNobody in the Helios Array trusted strangers, but Naren Corwick was no ordinary stranger. What Owick Rogwen had not told Naren Corwick was the truth of the variant beacon. The first test came sooner than anyone expected."
  },
  {
   "t": "New Ceres",
   "b": "Kacott Corwick refused another road. In the Helios Array, children still told stories about the variant beacon. Kacott Corwick ran the simulation three times. Same impossible result. Kacott Corwick never forgot that summer.\n\nThe summer turned, and with it the roads of everyone traveling to the Kepler Belt. They crossed the ridge at dawn, silent. At the crossing of the Kepler Belt, they were questioned.\n\nBy midday the light had changed, and Owick Rogwen knew they were being watched. Kacott Corwick accepted peace. void-born sent a warning that Kacott Corwick could not ignore. The variant beacon blazed, and the void-born wept. Kacott Corwick dreamed of the Helios Array, and woke with the variant beacon lighter in his hands. They crossed the ridge at dawn, tired.\n\nOwick Rogwen revealed what she had been carrying all along. Owick Rogwen arrived with a map, breathless and laughing. Kacott Corwick had never imagined this, but the variant beacon had chosen, and choice was a kind of gravity.\n\nKacott Corwick counted reasons to turn back and kept walking anyway. \"Remember,\" Kacott Corwick said, \"and do not look back.\" The void-born listened, patient as stone. Owick Rogwen held the line when it mattered most. The variant beacon was gone, but its echo remained."
  },
  {
   "t": "The Core",
   "b": "What Owick Rogwen had not told Belthon Corwick was the history of the variant beacon. Belthon Corwick chose the one thing she could not afford to lose. Belthon Corwick had never imagined this, but the variant beacon had chosen, and choice was a kind of gravity. Belthon Corwick looked at what remained of the variant beacon and smiled.\n\nThe void-born communicated in bursts, and Owick Rogwen was learning to read it. But the summer after, the rains were kinder, and people noticed. The storm lasted hours. Owick Rogwen stood by when it mattered most. Every song agreed on one thing: the variant beacon belonged in the Kepler Belt.\n\nThe variant beacon was restored, but its lesson remained. In the Kepler Belt, the variant beacon would either doom everything. Nobody knew which. The road home to the Helios Array felt sweeter than the road out.\n\nThe battle lasted all night. Years later, in the Helios Array, they still sing what Belthon Corwick did. The void-born listened, patient as old grief. \"Remember,\" Belthon Corwick said, \"and run.\" Owick Rogwen paid the price when it mattered most. Owick Rogwen arrived with a map, breathless and wide-eyed."
  },
  {
   "t": "Rogue Vector",
   "b": "The variant beacon had been missing for years, and everyone in the Helios Array knew the stories. The void-born communicated in light, and Owick Rogwen was learning to read it. void-born had agents everywhere, or so the songs claimed. The dark broke, and suddenly there was no more time for doubt.\n\nOwick Rogwen knew the old tunnels through the Kepler Belt, the ones the maps had forgotten. By midday the light had changed, and Owick Rogwen knew they were being tested. The variant beacon hummed faintly, as if it recognized Tawick Corwick.\n\nWhat Owick Rogwen had not told Tawick Corwick was the history of the variant beacon. The variant beacon blazed, and the void-born laughed. The colony's dome was failing, and only the variant beacon could explain it. Owick Rogwen knew the old paths through the Kepler Belt, the ones the maps had forgotten. \"Listen,\" Tawick Corwick said, \"and do exactly as I do.\" void-born stood revealed at last, and she was not what the legends had promised.\n\nWhat the variant beacon had cost could never quite be measured. The road to the Kepler Belt was forbidden, and the summer made it worse. The storm broke, and suddenly there was no more time for doubt."
  },
  {
   "t": "Event Horizon",
   "b": "The Signal waited in high orbit, lit. Ricott Corwick had never asked for this, but the variant beacon had chosen, and choice was a kind of gravity. Ricott Corwick accepted a quiet life. Stars looked wrong through the cracked viewport. Ricott Corwick woke up before dawn, the way Ricott Corwick always did when something was about to change. They crossed the marsh at dawn, silent.\n\nRicott Corwick understood, all at once, what the variant beacon had been trying to teach. And somewhere beyond the Kepler Belt, the sea kept the secret. At the crossing of the Kepler Belt, they were stopped. The variant beacon was gone, but its story remained. The Signal drifted in high orbit, silent.\n\nThe bargain lasted minutes. The variant beacon went quiet, and the void-born fled. The silence broke, and suddenly there was no more time for doubt. The children of the Helios Array would ask, and Ricott Corwick would begin. Ricott Corwick sacrificed the one thing she could not afford to lose. They crossed the ridge at dawn, hopeful.\n\nWhat Owick Rogwen had not told Ricott Corwick was the truth of the variant beacon. The variant beacon went quiet, and the void-born laughed. Owick Rogwen admitted what she had been carrying all along."
  },
  {
   "t": "The Choice",